{
  "prototype_id": "moment_arm",
  "item_id": "rotator_cuff_force_couple",
  "overall": {
    "status": "pass",
    "reason": "Top-5 overlap 1.00. Prime movers match the action-table sign. No held-out track."
  },
  "legality": {
    "status": "pass",
    "reason": "Every frame is inside toy_sagittal_v1 limits."
  },
  "joint_path": {
    "status": "abstain",
    "reason": "No held-out track."
  },
  "muscle_role": {
    "status": "pass",
    "reason": "Top-5 overlap 1.00. Prime movers match the action-table sign.",
    "overlap": 1.0,
    "predicted_top5": [
      "infraspinatus",
      "teres_minor",
      "supraspinatus",
      "middle_trapezius",
      "rhomboid_major"
    ],
    "reference_working": [
      "infraspinatus",
      "teres_minor"
    ],
    "sign_violations": []
  },
  "negative_control": {
    "status": "not_applicable",
    "reason": "This item is not a negative control."
  },
  "force_couple": {
    "status": "pass",
    "reason": "subscapularis (opposed) opposes infraspinatus, teres_minor (mover)."
  }
}
