{
  "prototype_id": "opensim_arm",
  "item_id": "glute_max_hip_extension",
  "overall": {
    "status": "fail",
    "reason": "Top-5 overlap 0.00 is below 0.60. Predicted none; reference gluteus_maximus, biceps_femoris."
  },
  "legality": {
    "status": "pass",
    "reason": "Every frame is inside arm26 limits."
  },
  "joint_path": {
    "status": "abstain",
    "reason": "No held-out track."
  },
  "muscle_role": {
    "status": "fail",
    "reason": "Top-5 overlap 0.00 is below 0.60. Predicted none; reference gluteus_maximus, biceps_femoris.",
    "overlap": 0.0,
    "predicted_top5": [],
    "reference_working": [
      "gluteus_maximus",
      "biceps_femoris"
    ],
    "sign_violations": []
  },
  "negative_control": {
    "status": "not_applicable",
    "reason": "This item is not a negative control."
  },
  "force_couple": {
    "status": "not_applicable",
    "reason": "This item has no force-couple claim."
  }
}
