{
  "prototype_id": "opensim_arm",
  "item_id": "lat_pulldown_as_face_pull",
  "overall": {
    "status": "pass",
    "reason": "Muscle role failed, as required for a negative control."
  },
  "legality": {
    "status": "pass",
    "reason": "Every frame is inside arm26 limits."
  },
  "joint_path": {
    "status": "abstain",
    "reason": "No held-out track."
  },
  "muscle_role": {
    "status": "fail",
    "reason": "Prime mover with the wrong moment-arm sign: biceps_brachii (no agreeing task coordinate).",
    "overlap": 0.0,
    "predicted_top5": [
      "biceps_brachii",
      "brachialis"
    ],
    "reference_working": [
      "posterior_deltoid",
      "infraspinatus",
      "teres_minor",
      "middle_trapezius",
      "lower_trapezius",
      "rhomboid_major"
    ],
    "sign_violations": [
      "biceps_brachii (no agreeing task coordinate)"
    ]
  },
  "negative_control": {
    "status": "pass",
    "reason": "Muscle role failed, as required for a negative control."
  },
  "force_couple": {
    "status": "not_applicable",
    "reason": "This item has no force-couple claim."
  }
}
