{
  "prototype_id": "static_opt",
  "item_id": "glute_max_hip_extension",
  "overall": {
    "status": "fail",
    "reason": "Top-5 overlap 0.50 is below 0.60. Predicted gluteus_maximus; reference gluteus_maximus, biceps_femoris."
  },
  "legality": {
    "status": "pass",
    "reason": "Every frame is inside toy_sagittal_v1 limits."
  },
  "joint_path": {
    "status": "abstain",
    "reason": "No held-out track."
  },
  "muscle_role": {
    "status": "fail",
    "reason": "Top-5 overlap 0.50 is below 0.60. Predicted gluteus_maximus; reference gluteus_maximus, biceps_femoris.",
    "overlap": 0.5,
    "predicted_top5": [
      "gluteus_maximus"
    ],
    "reference_working": [
      "gluteus_maximus",
      "biceps_femoris"
    ],
    "sign_violations": []
  },
  "negative_control": {
    "status": "not_applicable",
    "reason": "This item is not a negative control."
  },
  "force_couple": {
    "status": "not_applicable",
    "reason": "This item has no force-couple claim."
  }
}
